{
  "benchmark_id": "80_scatter_vs_01",
  "task_type": "vague_single",
  "widget_kind": "scatter",
  "question_set": [
    {
      "qid": "vs_01",
      "question": "How do session duration and calories burned relate on the Yoga-only scatter plot?",
      "question_style": "natural_language",
      "ground_truth": {
        "task_type": "vague_single",
        "answer": {
          "type": "open_ended",
          "value": "Yoga sessions form a fairly tight upward sweep: longer classes burn markedly more calories, and the correlation on the filtered points is very strong (around 0.92). Durations mostly fall between about half an hour and two hours, while calorie burn spans a few hundred up to the mid‑1500s for the longest sessions—so the story is less about scattered outliers and more about a steady climb."
        },
        "key_insights": [
          "Duration and calories move together strongly once other workout types are removed.",
          "Most Yoga points sit in a mid‑range duration band with calorie totals scaling up the longer people stay on the mat."
        ],
        "reasoning_trace": [
          {
            "iteration": 1,
            "capability": "data.filter.categorical",
            "rationale": "Strips out other workout modalities so the scatter reflects Yoga-only behavior."
          }
        ],
        "required_capabilities": [
          "data.filter.categorical"
        ],
        "required_perceptions": [],
        "capability_param_checks": [
          {
            "capability": "data.filter.categorical",
            "param_eval": {
              "type": "object",
              "param": "all_params",
              "target": {
                "field": "Workout_Type",
                "categories_to_remove": [
                  "Cardio",
                  "HIIT",
                  "Strength"
                ]
              }
            }
          }
        ],
        "canonical_state_checks": {},
        "renderer_state_checks": {
          "vega": {
            "data_filtered": [
              {
                "filter": "indexof([\"Cardio\", \"HIIT\", \"Strength\"], datum['Workout_Type']) < 0"
              }
            ]
          }
        },
        "state_check_fields": [
          "data_filtered"
        ]
      }
    }
  ],
  "data_source": {
    "kind": "rows_json",
    "dataset_id": "80_gym_members_exercise_tracking_scatter",
    "dataset_path": "datasets/80_gym_members_exercise_tracking_scatter.json",
    "row_count": 973,
    "dataset_scale_tag": "medium"
  },
  "materializations": {
    "vega": {
      "spec_path": "benchmark_annotation_system/backend/specs/80_gym_members_exercise_tracking_scatter.json"
    }
  },
  "benchmark_partition": "main"
}
