{
  "benchmark_id": "71_parallel_vs_01",
  "task_type": "vague_single",
  "widget_kind": "parallelCoordinates",
  "question_set": [
    {
      "qid": "vs_01",
      "question": "What is the characterization of the trend in AI tool usage percentage across different stress level groups and potential associations with burnout risk?",
      "question_style": "natural_language",
      "ground_truth": {
        "task_type": "vague_single",
        "answer": {
          "type": "open_ended",
          "value": "High stress combined with mid-range AI usage is most linked to burnout, rather than AI usage alone. "
        },
        "key_insights": [
          "Stress level groups 4–6 have AI tool usage spread evenly from 0–60%, with most lines showing low burnout risk.",
          "Stress level groups 8–10 have AI tool usage concentrated in 30–50%, and most of these lines show high burnout risk.",
          "The mid stress group (6–8) has a mixed distribution of AI usage and burnout risk, acting as a transition zone."
        ],
        "reasoning_trace": [
          {
            "iteration": 1,
            "capability": "parallel.dimensions.hide",
            "rationale": "Hiding dimensions organizes the data by stress level, making cross-group trends visible."
          }
        ],
        "required_capabilities": [
          "parallel.dimensions.hide"
        ],
        "required_perceptions": [],
        "capability_param_checks": [
          {
            "capability": "parallel.dimensions.hide",
            "param_eval": {
              "type": "object",
              "param": "all_params",
              "target": {
                "mode": "hide",
                "dimensions": [
                  "Code_Complexity_Score",
                  "Bugs_Introduced"
                ]
              }
            }
          }
        ],
        "canonical_state_checks": {},
        "renderer_state_checks": {
          "vega": {
            "data_filtered": [
              {
                "filter": "indexof([\"AI_Tool_Usage_%\", \"Stress_Level_1_10\"], datum['dimension']) >= 0",
                "_pc_hide_dimensions": true
              }
            ],
            "dimensions": {
              "hidden_fields": [
                "Code_Complexity_Score",
                "Bugs_Introduced"
              ]
            },
            "layers": {
              "count": 5,
              "types": [
                "rule",
                "line",
                null,
                null,
                null
              ]
            }
          }
        },
        "state_check_fields": [
          "data_filtered",
          "dimensions",
          "layers"
        ]
      }
    }
  ],
  "data_source": {
    "kind": "rows_json",
    "dataset_id": "71_one_person_ai_work_and_burnout_parallel",
    "dataset_path": "datasets/71_one_person_ai_work_and_burnout_parallel.json",
    "row_count": 900,
    "dataset_scale_tag": "medium"
  },
  "materializations": {
    "vega": {
      "spec_path": "benchmark_annotation_system/backend/specs/71_one_person_ai_work_and_burnout_parallel.json"
    }
  },
  "benchmark_partition": "main"
}
