{
  "benchmark_id": "06_parallel_cs_01",
  "task_type": "clear_single",
  "widget_kind": "parallelCoordinates",
  "question_set": [
    {
      "qid": "cs_01",
      "question": "Use hide_dimensions with mode equal to hide, hide_dimensions with dimensions equal to Beak Length (mm), Beak Depth (mm) to evaluate whether there is a visible correlation between body mass and flipper length.",
      "question_style": "tool_hinted",
      "ground_truth": {
        "task_type": "clear_single",
        "answer": {
          "type": "boolean",
          "value": "yes"
        },
        "key_insights": [],
        "reasoning_trace": [
          {
            "iteration": 1,
            "capability": "parallel.dimensions.hide",
            "rationale": "Use the hide-dimension tool to filter out irrelevant data. Observing the image, it is found that larger body mass corresponds to longer flipper length, indicating a correlation between the two variables."
          }
        ],
        "required_capabilities": [
          "parallel.dimensions.hide"
        ],
        "required_perceptions": [],
        "capability_param_checks": [
          {
            "capability": "parallel.dimensions.hide",
            "param_eval": {
              "type": "object",
              "param": "all_params",
              "target": {
                "mode": "hide",
                "dimensions": [
                  "Beak Length (mm)",
                  "Beak Depth (mm)"
                ]
              }
            }
          }
        ],
        "canonical_state_checks": {
          "encodings": {}
        },
        "renderer_state_checks": {
          "vega": {
            "layers": {
              "count": 5,
              "types": [
                "rule",
                "line",
                null,
                null,
                null
              ]
            },
            "dimensions": {
              "hidden_fields": [
                "Beak Length (mm)",
                "Beak Depth (mm)"
              ]
            }
          }
        },
        "state_check_fields": [
          "dimensions"
        ]
      }
    }
  ],
  "data_source": {
    "kind": "rows_json",
    "dataset_id": "06_parallel_penguins",
    "dataset_path": "datasets/06_parallel_penguins.json",
    "row_count": 30,
    "dataset_scale_tag": "small"
  },
  "materializations": {
    "vega": {
      "spec_path": "benchmark_annotation_system/backend/specs/06_parallel_penguins.json"
    }
  },
  "benchmark_partition": "hinted"
}
