{
  "benchmark_id": "07_bar_vs_01",
  "task_type": "vague_single",
  "widget_kind": "bar",
  "question_set": [
    {
      "qid": "vs_01",
      "question": "Using filter_categories, how does the relationship pattern exhibited by the 'average' and 'good' dietary quality categories correspond in terms of sleep duration?",
      "question_style": "tool_hinted",
      "ground_truth": {
        "task_type": "vague_single",
        "answer": {
          "type": "open_ended",
          "value": "The group with average dietary quality has significantly higher sleep duration than the group with good dietary quality, with a clear gap between the two."
        },
        "key_insights": [
          "The group with average dietary quality actually has longer sleep duration, indicating that the relationship between dietary quality and sleep duration is not a simple positive correlation."
        ],
        "reasoning_trace": [
          {
            "iteration": 1,
            "capability": "data.filter.categorical",
            "rationale": "To better compare the relationship between 'average' and 'good', I filtered out the 'poor' bars"
          }
        ],
        "required_capabilities": [
          "data.filter.categorical"
        ],
        "required_perceptions": [],
        "capability_param_checks": [
          {
            "capability": "data.filter.categorical",
            "param_eval": {
              "type": "object",
              "param": "all_params",
              "target": {
                "categories": [
                  "poor"
                ]
              }
            }
          }
        ],
        "canonical_state_checks": {},
        "renderer_state_checks": {
          "vega": {
            "data_filtered": [
              {
                "filter": "indexof([\"poor\"], datum['diet_quality']) < 0"
              }
            ]
          }
        },
        "state_check_fields": [
          "data_filtered"
        ]
      }
    }
  ],
  "data_source": {
    "kind": "rows_json",
    "dataset_id": "07_bar_synthetic_mental_health",
    "dataset_path": "datasets/07_bar_synthetic_mental_health.json",
    "row_count": 2000,
    "dataset_scale_tag": "large"
  },
  "materializations": {
    "vega": {
      "spec_path": "benchmark_annotation_system/backend/specs/07_bar_synthetic_mental_health.json"
    }
  },
  "benchmark_partition": "hinted"
}
