{
  "benchmark_id": "42_bar_cm_02",
  "task_type": "clear_multi",
  "widget_kind": "bar",
  "question_set": [
    {
      "qid": "cm_02",
      "question": "Use change_encoding first with channel equal to y and field equal to hp to get a new view, filter_categories with categories equal to dragon, water, fire, poison, electric, ground, fairy, fighting, normal, ice, ghost, rock, psychic, grass, steel to remove those types, then sort_bars with order equal to descending. Among the remaining types (dark and bug), which has the higher mean HP?",
      "question_style": "tool_hinted",
      "ground_truth": {
        "task_type": "clear_multi",
        "answer": {
          "type": "categorical",
          "value": "bug",
          "alternatives": []
        },
        "key_insights": [],
        "reasoning_trace": [
          {
            "iteration": 1,
            "capability": "view.encoding.change",
            "rationale": "Map HP to y-axis for comparison."
          },
          {
            "iteration": 2,
            "capability": "data.filter.categorical",
            "rationale": "Remove other types to focus on bug and dark only."
          }
        ],
        "required_capabilities": [
          "view.encoding.change",
          "data.filter.categorical"
        ],
        "required_perceptions": [],
        "capability_param_checks": [
          {
            "capability": "view.encoding.change",
            "param_eval": {
              "type": "object",
              "param": "all_params",
              "target": {
                "channel": "y",
                "field": "hp"
              }
            }
          },
          {
            "capability": "data.filter.categorical",
            "param_eval": {
              "type": "object",
              "param": "all_params",
              "target": {
                "categories": [
                  "dragon",
                  "water",
                  "fire",
                  "poison",
                  "electric",
                  "ground",
                  "fairy",
                  "fighting",
                  "normal",
                  "ice",
                  "ghost",
                  "rock",
                  "psychic",
                  "dark",
                  "steel"
                ]
              }
            }
          }
        ],
        "canonical_state_checks": {
          "encodings": {
            "x": "type_1",
            "y": "hp"
          }
        },
        "renderer_state_checks": {
          "vega": {
            "data_filtered": [
              {
                "filter": "indexof([\"dragon\",\"water\",\"fire\",\"poison\",\"electric\",\"ground\",\"fairy\",\"fighting\",\"normal\",\"ice\",\"ghost\",\"rock\",\"psychic\",\"grass\",\"steel\"], datum['type_1']) < 0"
              }
            ]
          }
        },
        "state_check_fields": [
          "encoding",
          "data_filtered"
        ]
      }
    }
  ],
  "data_source": {
    "kind": "rows_json",
    "dataset_id": "42_pokemon_stats_2025_bar",
    "dataset_path": "datasets/42_pokemon_stats_2025_bar.json",
    "row_count": 250,
    "dataset_scale_tag": "medium"
  },
  "materializations": {
    "vega": {
      "spec_path": "benchmark_annotation_system/backend/specs/42_pokemon_stats_2025_bar.json"
    }
  },
  "benchmark_partition": "hinted"
}
