{
  "benchmark_id": "42_bar_cm_01",
  "task_type": "clear_multi",
  "widget_kind": "bar",
  "question_set": [
    {
      "qid": "cm_02",
      "question": "What attribute possesses the maximum hp?",
      "question_style": "natural_language",
      "ground_truth": {
        "task_type": "clear_multi",
        "answer": {
          "type": "categorical",
          "value": "Water.",
          "alternatives": []
        },
        "key_insights": [],
        "reasoning_trace": [
          {
            "iteration": 1,
            "capability": "view.encoding.change",
            "rationale": "Use the tool to map hp onto the Y-axis."
          }
        ],
        "required_capabilities": [
          "view.encoding.change"
        ],
        "required_perceptions": [],
        "capability_param_checks": [
          {
            "capability": "view.encoding.change",
            "param_eval": {
              "type": "object",
              "param": "all_params",
              "target": {
                "field": "hp",
                "channel": "y"
              }
            }
          }
        ],
        "canonical_state_checks": {
          "encodings": {
            "x": "type_1",
            "y": "hp"
          }
        },
        "renderer_state_checks": {},
        "state_check_fields": [
          "encoding"
        ]
      }
    }
  ],
  "data_source": {
    "kind": "rows_json",
    "dataset_id": "42_pokemon_stats_2025_bar",
    "dataset_path": "datasets/42_pokemon_stats_2025_bar.json",
    "row_count": 250,
    "dataset_scale_tag": "medium"
  },
  "materializations": {
    "vega": {
      "spec_path": "benchmark_annotation_system/backend/specs/42_pokemon_stats_2025_bar.json"
    }
  },
  "benchmark_partition": "main"
}
