{
  "benchmark_id": "59_heatmap_vs_02",
  "task_type": "vague_single",
  "widget_kind": "heatmap",
  "question_set": [
    {
      "qid": "vs_01",
      "question": "Using highlight_region_by_value, which patient subgroup defined by Pregnancies and Outcome appears to have the most severe hypertension risk?",
      "question_style": "tool_hinted",
      "ground_truth": {
        "task_type": "vague_single",
        "answer": {
          "type": "open_ended",
          "value": "Based on the darkest color shade, the subgroup with Pregnancies=13 and Outcome=1 appears to have the highest mean blood pressure, indicating the most severe hypertension risk among the four groups."
        },
        "key_insights": [
          "By setting the tool to highlight cells with values in the top range, or by manually observing, we can subjectively identify the darkest cell. This visually pinpoints the subgroup with the highest mean blood pressure."
        ],
        "reasoning_trace": [
          {
            "iteration": 1,
            "capability": "heatmap.region.highlight",
            "rationale": "We use this tool to interactively highlight cells above a certain threshold (e.g., >100 mmHg) or to visually compare the darkest region."
          }
        ],
        "required_capabilities": [
          "heatmap.region.highlight"
        ],
        "required_perceptions": [],
        "capability_param_checks": [
          {
            "capability": "heatmap.region.highlight",
            "param_eval": {
              "type": "object",
              "param": "all_params",
              "target": {
                "min_value": 100,
                "outside_opacity": 0.8
              }
            }
          }
        ],
        "canonical_state_checks": {},
        "renderer_state_checks": {
          "vega": {
            "opacity": {
              "has_opacity": true,
              "has_condition": true
            }
          }
        },
        "state_check_fields": [
          "opacity"
        ]
      }
    }
  ],
  "data_source": {
    "kind": "rows_json",
    "dataset_id": "59_health care diabetes_heatmap",
    "dataset_path": "datasets/59_health care diabetes_heatmap.json",
    "row_count": 768,
    "dataset_scale_tag": "medium"
  },
  "materializations": {
    "vega": {
      "spec_path": "benchmark_annotation_system/backend/specs/59_health care diabetes_heatmap.json"
    }
  },
  "benchmark_partition": "hinted"
}
