{
  "benchmark_id": "98_heatmap_cm_01",
  "task_type": "clear_multi",
  "widget_kind": "heatmap",
  "question_set": [
    {
      "qid": "cm_02",
      "question": "What is the Experience_Level with the highest mean BMI among the remaining workout types?",
      "question_style": "natural_language",
      "ground_truth": {
        "task_type": "clear_multi",
        "answer": {
          "type": "categorical",
          "value": "Experience Level 2",
          "alternatives": [
            "2",
            "Experience_Level 2"
          ]
        },
        "key_insights": [
          "Strength consistently has a higher mean BMI than HIIT across all levels.",
          "Experience Level 2 has the highest combined BMI for these workouts."
        ],
        "reasoning_trace": [
          {
            "iteration": 1,
            "capability": "heatmap.cells.filter",
            "rationale": "Exclude Yoga column to focus on Strength, HIIT, Cardio."
          },
          {
            "iteration": 2,
            "capability": "analysis.extremes.find",
            "rationale": "Find the Experience_Level with the maximum BMI among the remaining cells."
          }
        ],
        "required_capabilities": [
          "heatmap.cells.filter",
          "analysis.extremes.find"
        ],
        "required_perceptions": [],
        "capability_param_checks": [
          {
            "capability": "heatmap.cells.filter",
            "param_eval": {
              "type": "object",
              "param": "all_params",
              "target": {
                "x_value": "Yoga"
              }
            }
          },
          {
            "capability": "analysis.extremes.find",
            "param_eval": {
              "type": "object",
              "param": "all_params",
              "target": {
                "top_n": 1,
                "mode": "max"
              }
            }
          }
        ],
        "canonical_state_checks": {
          "encodings": {
            "x": "Workout_Type",
            "y": "Experience_Level",
            "color": "BMI"
          }
        },
        "renderer_state_checks": {
          "vega": {
            "data_filtered": [
              {
                "filter": "!(indexof([\"Yoga\"], datum['Workout_Type']) >= 0)",
                "_avs_tag": "filter_cells_by_region"
              }
            ]
          }
        },
        "state_check_fields": [
          "data_filtered"
        ]
      }
    }
  ],
  "data_source": {
    "kind": "rows_json",
    "dataset_id": "98_gym_members_exercise_tracking_heatmap",
    "dataset_path": "datasets/98_gym_members_exercise_tracking_heatmap.json",
    "row_count": 973,
    "dataset_scale_tag": "medium"
  },
  "materializations": {
    "vega": {
      "spec_path": "benchmark_annotation_system/backend/specs/98_gym_members_exercise_tracking_heatmap.json"
    }
  },
  "benchmark_partition": "main"
}
