{
  "benchmark_id": "38_scatter_cs_03",
  "task_type": "clear_single",
  "widget_kind": "scatter",
  "question_set": [
    {
      "qid": "cs_03",
      "question": "Use calculate_correlation in order to know Use calculate_correlation with method equal to pearson to compute the correlation between Smoothness (mean) and Compactness (mean).",
      "question_style": "tool_hinted",
      "ground_truth": {
        "task_type": "clear_single",
        "answer": {
          "type": "categorical",
          "value": "0.659",
          "alternatives": []
        },
        "key_insights": [],
        "reasoning_trace": [
          {
            "iteration": 1,
            "capability": "analysis.correlation.compute",
            "rationale": "Calculate the Pearson correlation coefficient between Smoothness (mean) and Compactness (mean) to determine their relationship"
          }
        ],
        "required_capabilities": [
          "analysis.correlation.compute"
        ],
        "required_perceptions": [],
        "capability_param_checks": [
          {
            "capability": "analysis.correlation.compute",
            "param_eval": {
              "type": "object",
              "param": "all_params",
              "target": {
                "method": "pearson"
              }
            }
          }
        ],
        "canonical_state_checks": {},
        "renderer_state_checks": {},
        "state_check_fields": []
      }
    }
  ],
  "data_source": {
    "kind": "rows_json",
    "dataset_id": "38_cancer_scatter",
    "dataset_path": "datasets/38_cancer_scatter.json",
    "row_count": 569,
    "dataset_scale_tag": "medium"
  },
  "materializations": {
    "vega": {
      "spec_path": "benchmark_annotation_system/backend/specs/38_cancer_scatter.json"
    }
  },
  "benchmark_partition": "hinted"
}
