{
  "benchmark_id": "117_parallel_cs_01",
  "task_type": "clear_single",
  "widget_kind": "parallelCoordinates",
  "question_set": [
    {
      "qid": "cs_01",
      "question": "How does one characterize the scale and financing situation of a company during the IPO stage based on the Funding Stage?",
      "question_style": "natural_language",
      "ground_truth": {
        "task_type": "clear_single",
        "answer": {
          "type": "categorical",
          "value": "Generally, the company is not large in size but can secure a relatively high amount of financing.",
          "alternatives": []
        },
        "key_insights": [],
        "reasoning_trace": [
          {
            "iteration": 1,
            "capability": "data.filter.categorical",
            "rationale": "get data"
          }
        ],
        "required_capabilities": [
          "data.filter.categorical"
        ],
        "required_perceptions": [],
        "capability_param_checks": [
          {
            "capability": "data.filter.categorical",
            "param_eval": {
              "type": "object",
              "param": "all_params",
              "target": {
                "field": "Funding Stage",
                "values": [
                  "Series B",
                  "Series C",
                  "Series A",
                  "Seed"
                ]
              }
            }
          }
        ],
        "canonical_state_checks": {
          "encodings": {
            "x": "dimension"
          }
        },
        "renderer_state_checks": {
          "vega": {
            "data_filtered": [
              {
                "filter": "indexof([\"Series B\",\"Series C\",\"Series A\",\"Seed\"], datum['Funding Stage']) < 0"
              }
            ],
            "layers": {
              "count": 5,
              "types": [
                "rule",
                "line",
                null,
                null,
                null
              ]
            }
          }
        },
        "state_check_fields": [
          "data_filtered"
        ]
      }
    }
  ],
  "data_source": {
    "kind": "rows_json",
    "dataset_id": "117_startup_funding_dataset_parallel",
    "dataset_path": "datasets/117_startup_funding_dataset_parallel.json",
    "row_count": 4000,
    "dataset_scale_tag": "large"
  },
  "materializations": {
    "vega": {
      "spec_path": "benchmark_annotation_system/backend/specs/117_startup_funding_dataset_parallel.json"
    }
  },
  "benchmark_partition": "main"
}
