{
  "benchmark_id": "92_sankey_cs_01",
  "task_type": "clear_single",
  "widget_kind": "sankey",
  "question_set": [
    {
      "qid": "cs_01",
      "question": "What is the product line that receives the largest amount of signed value?",
      "question_style": "natural_language",
      "ground_truth": {
        "task_type": "clear_single",
        "answer": {
          "type": "categorical",
          "value": "Enterprise SaaS Platform ",
          "alternatives": []
        },
        "key_insights": [
          "The Enterprise SaaS Platform receives the largest share of signed value from Channel Partner leads."
        ],
        "reasoning_trace": [
          {
            "iteration": 1,
            "capability": "sankey.path.highlight",
            "rationale": "Filtering to isolate Channel Partner leads simplifies the view, making it easier to trace and compare the flow of value to each product line."
          }
        ],
        "required_capabilities": [
          "sankey.path.highlight"
        ],
        "required_perceptions": [],
        "capability_param_checks": [
          {
            "capability": "sankey.path.highlight",
            "param_eval": {
              "type": "object",
              "param": "all_params",
              "target": {
                "path": [
                  "Channel Partner",
                  "Enterprise SaaS Platform",
                  "Data Middleware Product",
                  "Maintenance Service"
                ]
              }
            }
          }
        ],
        "canonical_state_checks": {
          "encodings": {}
        },
        "renderer_state_checks": {},
        "state_check_fields": []
      }
    }
  ],
  "data_source": {
    "kind": "rows_json",
    "dataset_id": "92_sankey_b2b",
    "dataset_path": "datasets/92_sankey_b2b.json",
    "row_count": null,
    "dataset_scale_tag": null
  },
  "materializations": {
    "vega": {
      "spec_path": "benchmark_annotation_system/backend/specs/92_sankey_b2b.json"
    }
  },
  "benchmark_partition": "main"
}
